Link,Title,Location,Salary,Summary
https://kr.indeed.com/viewjob?jk=b95d00f1145e5ef3,(광주취업맛집1위)2021년도 국비 기술교육생,대한상공회의소 광주인력개발원 광주 광산구,,통신·모바일·게임>빅데이터·AI(인공지능)>데이터분석|인터넷·IT·통신·모바일·게임>빅데이터·AI(인공지능)> Python|인터넷·IT·통신·모바일·게임>빅데이터·AI(인공지능)>머신러닝|인터넷·IT·통신·모바일·게임>빅데이터...
https://kr.indeed.com/viewjob?jk=9e1861e691426a98,Field AI Engineer,Graphcore 서울,,"hardware acceleration technologies Experience with Python and C++... depth knowledge of computer architectures, high..."
https://kr.indeed.com/viewjob?jk=a857c12c4c3292be,[Search] 클라우드 컴퓨팅 쿼리 엔진 플랫폼 BE 개발 신입/경력사...,네이버 서울,,이터 분석 및 시각화 [자격요건] · CS 관련 탄탄한 기본기를 바탕으로 습득이 빠르신 분 · Java / Python / C / C++ 중 1 개 이상의 언어로 개발 가능 · 리눅스 환경에서 개발 및 운영 경험 [우대사항...
https://kr.indeed.com/viewjob?jk=b40a553df450c1b4,[데이타게이트 코리아] IT지원 기술자/개발자,데이타게이트코리아 서울 구로구,,Platform 사용 경험자 ㆍApache OSS(Open Source Software) 사용 경험자 ㆍJava/ Python 개발 경험자 0 명 근무조건 고용형태: 정규직(수습기간3개월) 근무부서: 솔루션사업팀 인근전철역...
https://kr.indeed.com/viewjob?jk=cbec3e35c0a250c5,[경력] 웹 프로그램 개발자 - ITS,삼정 KPMG 3.3 서울 강남구,,"MS-SQL을 활용한 개발 경험 - Power BI, SQL Server Reporting Services, python 등 다양한 개발환경에 관심이 많은 자 4. 우대사항 - Classic ASP를 활용한 개발 경험..."
https://kr.indeed.com/viewjob?jk=b0363f98a9e40b13,"Python 경력 개발자 (또는 Golang, 경력5년이상)",피넛테크 서울 강남구,,"데이터 수집/분석 처리 [자격요건] 1. 학력 : 무관 2. 경력 : 경력 5년 이상 [필수역량] 1. Python 개발자 (or Golang 개발자 가능) 2. 분산처리로 대용량 데이터 수집, 분석 경험 [우대조건] 1..."
https://kr.indeed.com/viewjob?jk=4e91309fc89e9534,2020년 하반기 영업/기획/마케팅/개발 부문,아우토크립트 서울 영등포구,,통신·모바일·게임>응용프로그래머> Python|인터넷·IT·통신·모바일·게임... 프로그래머> Python|인터넷·IT·통신·모바일·게임>웹프로그래머>JAVA|인터넷·IT·통신·모바일·게임>빅데이터·AI(인공지능)> Python|인터넷...
https://kr.indeed.com/viewjob?jk=169b3989561eb056,Application Architect,Amazon Web Services Korea LLC 서울,,"C#, Swift, Node.js, Python, Go, or Ruby... JavaScript, C / C ++, C #, Swift, Node.js, Python, Go 또는 Ruby 중 두 개 이상의 언어를 활용한 코딩..."
https://kr.indeed.com/viewjob?jk=b6b000f15a77f402,"협동로봇, 메카트로닉스, 공정엔지니어 외 신입 정규직",씨엔로봇 대전 중구,,"활용 교직원 연수 - 실습장비 활용 학생 연수 - 실습장비 납품 후 활용 교육 ㅇ 협동로봇 티칭 및 교육 - Python, ROS, C# 등 프로그래밍 및 교육 - PLC, HMI 프로그래밍 및 교육 [근무부서 및 직급/직책..."
https://kr.indeed.com/viewjob?jk=6bf25be7270a4108,(수정)동국대학교 데이터분석팀 일반연구원(계약직) 채용,동국대학교 4.3 서울 필동,,"자 4) 남자의 경우 병역필 또는 면제자 5) 한글, MS OFFICE 등 기본 문서작업 가능자 6) Python, R 프로그래밍 언어 사용 가능자 우대 2. 모집인원 : 0명 3. 근무조건 및 계약기간 구 분..."
https://kr.indeed.com/viewjob?jk=84fd9f9deb6105b0,"웹개발, Python 외 신입/경력 계약직",쿠바로엠앤씨 서울 강서구,,"주식회사 쿠바로엠앤씨 웹개발, Python 외 신입/경력 계약직 채용 모집... 게임>웹프로그래머>웹개발|인터넷·IT·통신·모바일·게임>웹프로그래머> Python|인터넷·IT·통신·모바일·게임>웹프로그래머>백엔드|인터넷·IT·통신..."
https://kr.indeed.com/viewjob?jk=df21e3bb5d773616,Python Programmer,Mofac 서울 서초구,,개발 – JAVA 프로그래밍(라이브러리 활용) – Spring 프레임 워크 개발 – Python API 프로그래밍 우대사항 – Python 개발 경험 – Open Source 라이브러리 개발경험 – Web 표준에 대한 경험...
https://kr.indeed.com/viewjob?jk=9040dba1c8db2a5d,퀀트운용팀 (사원-대리급),신한비엔피파리바자산운용 대한민국,,지식 보유자 - 투자자산운용사 자격증 소지자 우대 - CFA/CAIA/CPA 자격증 소지자 우대 - VBA/ Python 활용한 업무 가능자 우대 - 관련 전공 및 석박사 학위/금융 관련 자격증 보유자 우대 3. 전형방법...
https://kr.indeed.com/viewjob?jk=dd4d8e59a4a9265d,Data Specialist (Scientist&&Engineer),아우름플래닛 서울 마포구,,"Tensorflow, Keras, Pytorch, Theano 등)를 하나 이상 사용할 수 있는 분 • R, Python, Scala, SQL 등을 이용한 데이터 분석 및 프로그램 개발 능력이 있는 분 • 데이터 분석 기법..."
https://kr.indeed.com/viewjob?jk=969d5d92ff231296,[대기업 통신사] 데이터 사이언티스트 초빙,TrueHR 서울 용산구,,"모델링 Tool(R, SAS, Python 등) 석사 출신 우대 ADP... Google Analytics), 분석, 모델링 Tool(R, SAS, Python 등) 석사 출신 우대 ADP 소유자 우대 0 명 근무조건 고용형태..."
https://kr.indeed.com/viewjob?jk=650893f0672cebc3,테크센터개발팀 - 웹 프로그래머,Nexon 성남 분당구,,"웹 어플리케이션 개발 경력 3년 이상 - 프로그래밍 언어 무관 (C#, Java, Javascript, Python, Go, PHP 등) - 프레임워크 무관 ( .NET MVC, Spring, node.js(Express..."
https://kr.indeed.com/viewjob?jk=27ea6faf6a8516fd,퀀트 개발자 (Quant Developer),ATZ Inc. 서울,,any... following languages. (C/C++/C#/ Python/Java/Node.js)* Experience with R... languages) C/C++/C#/ Python/Java R/Excel...
https://kr.indeed.com/viewjob?jk=9fe4755841bec8ce,"데이터 분석 및 컨설팅 분야 (Python, SAS, 빅데이터) 경력직",한국정보기술단 과천 과천시,,"데이터 분석 및 컨설팅 분야 ( Python, SAS, 빅데이터) 경력직... 대졸 이상 (학사 이상 우대) - 데이터 분석 분야 경력 2년 이상 ( Python, R, SAS 기반의 DATA Preparation, 통계, 머신러..."
https://kr.indeed.com/viewjob?jk=4cd34228af5013fd,DGIST 2019년 제1차 계약직원 공개채용 공고,대구경북과학기술원 대구 현풍면,,"우수자(SPSS, R 등 통계패키지) 외국어(영어) 구사 능력 우수자 Programming(MATLAB, Python, C/C++ 등) 가능자 · 근무기간 : 2019.3.11.~2020.3.10. ※ 단, 재계약 평가에..."
https://kr.indeed.com/viewjob?jk=b1df6255ca9c5d10,주4일 Web/App 개발자 AI/IoT 회사,휴네이처 서울 중구,,"록하지 않으셨다면!! 상세 이력서 등록하기 지원양식 커리어 온라인 이력서 직무/산업 직무별(직종) 웹프로그래머웹프로그래머, PHP, Python 응용프로그래머전산전공, Application 산업별(업종) 통신사.네트워크 통신"
https://kr.indeed.com/viewjob?jk=cd40cf786e32f325,사내 및 서비스 보안 담당자 (경력),네오위즈 대한민국,,"GuardDuty, WAF, VPC Flow Logs 분석 등)이 있으신 분 - 각종 스크립트 언어(Perl, Python, shell script 등)의 활용 능력을 가진 분 - 모바일 게임 앱에 대한 보안 검수 경험이..."
https://kr.indeed.com/viewjob?jk=77dfad5a778a94c2,Senior Data Scientist,Boston Consulting Group 4.2 서울,,"leadership. Fluency... least one scripting language (e.g. Python, R) Fluency in English local office language is required..."
