Link,Title,Location,Salary,Summary
https://kr.indeed.com/viewjob?jk=55584c627df1acaa,데이터 분석가/사이언티스트(신입/인턴 가능),쏘카 대한민국,,"Sheet) 등 데이터 분석 도구를 원활히 다루시거나, 앞으로 원활히 다루고자 하는 의지가 높으신 분 • Python, R 등의 프로그래밍 언어 혹은 데이터 분석 언어를 1개 이상 능숙하게 사용 가능하신 분 전형절차 서류..."
https://kr.indeed.com/viewjob?jk=668a66da41da83d3,2021년도 국가정보원 연계형 인턴 선발,국가정보원 서울 서초구,,C·C++|인터넷·IT·통신·모바일·게임>응용프로그래머> Python|교육·교사·강사·교직원>IT·문화·직업강사>프로그래밍|인터넷·IT·통신·모바일·게임>웹프로그래머> Python|인터넷·IT·통신·모바일·게임>통신·모바일>보안...
https://kr.indeed.com/viewjob?jk=a64e1e21f61265ce,각 분야별 인재 Pool 등록,지투알 서울,,"자 - 데이터 분석 툴(Adobe Analytics 또는 Google Analytics) 유경험자 우대 - Python, R, SQL 역량 보유자 우대 - 데이터에 기반한 문제해결 능력 및 통계학적 지식 보유자 우대 - 담당..."
https://kr.indeed.com/viewjob?jk=2d3b7de44ce0cbeb,Data Scientist,Motion2AI 서울,,"thinking to define unstructured problems - Experience with Python (pandas, numpy), R, SQL... VBA to deal... large..."
https://kr.indeed.com/viewjob?jk=50a4d23577c58924,2021년 2분기 에이비엘생명보험 신입/경력/인턴 직원,ABL생명보험 서울 영등포구,,"해외여행 결격 사유가 없는 자 - 유사 업무 5년 이상 경력(통계분석 및 언더라이팅) [우대사항] - 프로그래밍( Python, DB SQL 등) - 디지털 기술(Machine learning/Bigdata/AI 등) - MS..."
https://kr.indeed.com/viewjob?jk=4910d33b5b470a5f,[Clova CIC] AI/ML 개발 인턴사원,네이버 서울,,"대한 기본 지식 - PyTorch나 Tensorflow와 같은 딥러닝 프레임워크에 대한 지식 및 개발 경험 - Python을 사용한 소프트웨어 개발 경험 우대사항 - 컴퓨터과학, 컴퓨터 엔지니어링, 수학 및 관련 분야 전공..."
https://kr.indeed.com/viewjob?jk=e1ebfac18d00b273,[SK바이오사이언스] 21년 1분기 수시,에스케이바이오사이언스 성남 분당구,,"Office (excel, PPT 등) 활용 능력 - 우 대 1) SAP SD 모듈 활용 가능자 2) Python, R 등 다양한 data분석 tool 활용 가능자 마케팅PM - 직 무 1) 시장 분석 및 projection..."
https://kr.indeed.com/viewjob?jk=b5b88516a299bbb2,(주)신세계아이앤씨 경력사원 상시,신세계아이앤씨 서울 중구,,"0명 공통사항 -. 자동화 Tool에 대한 이해 보유자 -. JAVA, C, JavaScript, Python, HTML, JSP 등 프로그래밍 언어 개발 경험자... Process 및 Process Mangement에..."
https://kr.indeed.com/viewjob?jk=a8de67022a7e45f2,자산·디지털 부문 경력사원 채용,삼성생명 4.1 서울 서초동,,"우대사항] -회사경력 7년↑(석사 5년↑) 또는 박사학위 보유 - Python기반 서비스 개발 경험 -IT(컴퓨팅, AI, ML 等)관련 학과 전공... 리에 대한 전문 지식 보유자 - Python, Tensorflow기반 딥러..."
https://kr.indeed.com/viewjob?jk=7b04030358d701b1,[서울시뉴딜] 디지털사이니지 · 실감콘텐츠 분야 전문인력 양성 교육 /...,스마트미디어산업진흥협회 서울,,통신·모바일·게임>웹프로그래머> Python|인터넷·IT·통신·모바일·게임... 로그래머>머신러닝(ML)|인터넷·IT·통신·모바일·게임>응용프로그래머> Python|인터넷·IT·통신·모바일·게임>응용프로그래머>증강현실(AR)|인터넷...
https://kr.indeed.com/viewjob?jk=b86fa42793152db8,[Search] 클라우드 컴퓨팅 플랫폼 BE 개발 신입/경력사원,네이버 서울,,위한 기술 제안 [자격요건] · CS 관련 탄탄한 기본기를 바탕으로 습득이 빠르신 분 · Java / Python / C / C++ 중 1 개 이상의 언어로 개발 가능 · 리눅스 환경에서의 개발 경험 · 우수한 문제 분석...
https://kr.indeed.com/viewjob?jk=112e58d399a83a19,BIM Manager,SYSTRA 서울,,"Openroads, Navigator. Microsoft: Office 365. IT language: Python (A plus) Others: Dynamo (A plus) Job Segment: Engineer..."
https://kr.indeed.com/viewjob?jk=57ad151ff89a3275,Engineering Manager - EdgeX - IoT,Canonical - Jobs 서울,,"engineer Significant programming experience in C, Golang, Python, or like languages A solid understanding... makeup..."
https://kr.indeed.com/viewjob?jk=790d6275c9dd7be8,Data Scientist 모집,한독약품 서울,,"관련 경력 3년 이상 Healthcare data 분석 경험자 데이터 분석 Tool (SQL, Python, R중 하나 이상) 활용자 Tableau, Power BI 활용 경험자 MS Office (특히..."
https://kr.indeed.com/viewjob?jk=e8a4630bec0783e8,2021 Market Data Analyst - Seoul,Bloomberg 서울,,"work experience using one more programming language... Python, SQL and R Fluency in Korean and English (both spoken..."
https://kr.indeed.com/viewjob?jk=d143cbffed5f5411,[Search] 클라우드 AI 플랫폼 BE 개발 신입/경력사원,네이버 서울,,신러닝 플랫폼 개발 [자격요건] · CS 관련 탄탄한 기본기를 바탕으로 습득이 빠르신 분 · Java / Python / Go 언어 중 1 개 이상의 언어로 개발이 가능한 분 · 리눅스 환경에서 개발이 가능하신 분 [우대...
https://kr.indeed.com/viewjob?jk=0224e8cd9aba5320,Network Engineer,Blizzard Entertainment 서울,,Environment and troubleshooting Linux network configuration. Python/Bash scripting experience. Bachelor’s degree in computer...
https://kr.indeed.com/viewjob?jk=4adac8923476d038,프랭클린템플턴투신운용 Junior Trader (Quant base 필수...,프랭클린템플턴투신 대한민국,,"object-oriented programming and intermediate programming proficiency in Python, R or MATLAB, and SQL are essential. Licenses..."
https://kr.indeed.com/viewjob?jk=b574f1454ae36aab,Cross Border Ecommerce - Business Intell...,Shopee 서울,,business analyst related roles Proficient in SQL and Python Strong analytical skill and sensitivity to data Strong oral...
https://kr.indeed.com/viewjob?jk=047d35a5f56c31bd,"대기업 딥러닝 기반 영상처리 개발자 (박사급, 판교)",인파트너스 서울,,"Pytorch - Python, C/C++, Docker  C/C++... 머신러닝|인터넷·IT·통신·모바일·게임>빅데이터·AI(인공지능)> Python|인터넷·IT·통신·모바일·게임>시스템프로그래머>임베디드(Embedded)"
https://kr.indeed.com/viewjob?jk=f9dcc4b277dfcebc,[Search] [Vision] Computer Vision Engine...,네이버 서울,,"스템 엔지니어링 · 스마트렌즈 , 이미지 / 동영상 검색 , 비주얼 커머스 서비스 고도화에 기여 [자격요건] · Python, C++, Golang, Scala 등의 백엔드 개발 언어를 1 개 이상 자유롭게 활용 가능한 분..."
https://kr.indeed.com/viewjob?jk=c60342e316e77e0c,Data Scientist,LG전자 3.8 서울 영등포구,,"이상) 전공: 통계학, 컴퓨터 공학 등 유사 전공 필요 업무경험 : 1. 데이터 분석/모델링 수행 - R/ Python/SAS 등의 분석 Tool을 활용하여 정형/비정형 데이터 분석 수행 - 대용량 원천 데이터의 탐색적 분석을..."
https://kr.indeed.com/viewjob?jk=473f19e484779599,국내카드사 DW개발,제이엔커리어 서울 서초구,,"Presto 등 Hadoop Ecosystem의 이해 필요 - JAVA, Python 개발 경험자 - 프레임워크 외 오픈소스 도입 등의 유연한 사고... 의 이해 필요 - JAVA, Python 개발 경험자 - 프레임워크 외..."
https://kr.indeed.com/viewjob?jk=89f3e10d77a126bf,Field Service Engineer,Nearfield Instruments 대한민국,,"troubleshooting. Preferably to have coding capability (Matlab, Python...etc... data analysis, visualization, and algorithm..."
https://kr.indeed.com/viewjob?jk=93c307b1bbc3fa17,[Biz] 버티컬 서비스(여행/Flyer) & 광고플랫폼 FE/BE 개발...,네이버 서울,,"시스템 개발 - 네이버 광고 개인화 추천 시스템 개발 [자격요건] - Kotlin, Java, Scala, Python 중 1개 이상의 언어를 사용하여 웹서비스 개발 개발 2년 이상 - HTTP프로토콜에 대한 이해와 1개..."
https://kr.indeed.com/viewjob?jk=011e6ca8a669f12e,2021년 3월 신입/경력,나이스피앤아이 서울 여의도,,"상경계열, 통계학, 수학, 공학 전공 - 프로그래밍 및 통계 Package 활용 (VBA, C++, R, Python, Matlab 등) - 유관 전공 석사, 박사(과정) 2. 기업가치평가 부문(신입/경력) [담당업무..."
https://kr.indeed.com/viewjob?jk=fe4c9348f8e01e44,AI / Machine Learnig 컨설턴트 - 글로벌 컨설팅Firm,에스에프인촌 서울,,본적으로 비즈니스 문제 해결이 가능한 컨설팅 자질을 갖추고 있어야 함 - Python 등 관련 코딩 경험자 우대 3) 영어 활용 능력 우수자 우대 4... 자질을 갖추고 있어야 함 - Python 등 관련 코딩 경험자 우대 3...
https://kr.indeed.com/viewjob?jk=8b950c3f1114b37b,[Clova CIC] AI/ML 개발자,네이버 서울,,"대한 기본 지식 - PyTorch나 Tensorflow와 같은 딥러닝 프레임워크에 대한 지식 및 개발 경험 - Python을 사용한 소프트웨어 개발 경험 우대사항 - 컴퓨터과학, 컴퓨터 엔지니어링, 수학 및 관련 분야 전공..."
https://kr.indeed.com/viewjob?jk=996aed4fb9a166e0,[정규직] 금융 신규사업(AI예측기반 Data사업) 데이터 분석 전문인력,SK 씨앤씨 4.0 서울,,역량/스킬 - 금융 시장지수/가격 등 데이터에 대한 이해 - 금융/시계열 BigData/AI 분석역량(R/ Python/Tensorflow/pyTorch 등) - 개별예측모델 구축 및 앙상블 분석/최적화 역량 - Agile...
https://kr.indeed.com/viewjob?jk=3b9924be7b4b6c77,[EY컨설팅] 컨설팅본부 TC Digital 팀 인턴 모집,Ernst & Young 4.0 대한민국,,"역량 (관련 동아리/학회 인력 선호) - SQL 또는 Python 활용 능력 필수 - 대학 과제, 동아리활동, Part-time Job 등을 통해 SQL 또는 Python을 실제 사용해 본 경험 필요 - 컨설팅 업무에..."
https://kr.indeed.com/viewjob?jk=ba2e4263cb6ac18c,[보안솔루션] 딥러닝 아키텍쳐 부문,컴트루테크놀로지 서울 마포구,,"전공 해당 분야 관련 영어 문서를 읽고 응용할 수 있는 독해 능력 Python 언어 사용 가능자 PyTorch, Tensorflow 등 딥러닝 프레임... 게임>빅데이터·AI(인공지능)> Python|인터넷·IT·통신·모바일·게임..."
https://kr.indeed.com/viewjob?jk=dfb20fa220f3c478,"빅데이터, 인공지능(AI) 외 신입/경력 인턴",스칼라웍스 대한민국,,인공지능)>인공지능(AI)|인터넷·IT·통신·모바일·게임>빅데이터·AI(인공지능)>데이터분석|인터넷·IT·통신·모바일·게임>빅데이터·AI(인공지능)> Python|인터넷·IT·통신·모바일·게임>빅데이터·AI(인공지능)>딥러닝
https://kr.indeed.com/viewjob?jk=f5a6c39b170b4a51,(주)엘솔루 웹 개발자,㈜엘솔루 서울,,Javascript / React / Python / NodeJS 개발... Stack 개발 유경험자 ㆍJavascript / React / Python / NodeJS 개발 유경험자 ㆍHTML 5 개발 가능자(필수) 1명...
https://kr.indeed.com/viewjob?jk=39e99c8ed1d40a8f,2021 토스 전 계열사 대규모,비바리퍼블리카 서울 강남구,,게임>빅데이터·AI(인공지능)> Python|인터넷·IT·통신·모바일·게임... 용프로그래머>Linux|인터넷·IT·통신·모바일·게임>응용프로그래머> Python|인터넷·IT·통신·모바일·게임>응용프로그래머>iOS|인터넷·IT·통신...
https://kr.indeed.com/viewjob?jk=afeaf9f2fdda7973,"Engr, Apps Dev 3",KLA-Tencor 대한민국,,"working effectively with different cultures. Matlab/ Python experience is a plus. We offer a competitive, family friendly..."
https://kr.indeed.com/viewjob?jk=010d38b18b07b6bb,데이터 분야 경력,LG CNS 3.7 서울,,"해가 뛰어난 자 - R, Python, SAS, SQL 등 활용 역량 우대사항(해당 내용 중 1개 이상) - ML/DL 경험 인력 우대 - 관련 분야 석사 이상 학위 소지자 우대 - R, Python등 데이터분석 모델링 경험..."
https://kr.indeed.com/viewjob?jk=e7c8c2b11f24fb43,Software Engineer,Google 4.3 서울,,"languages, including... limited to: C++, Java, C and Python. Excellent written and verbal communication skills. About..."
https://kr.indeed.com/viewjob?jk=be95b5718905880f,AI/빅데이터/클라우드 분야 (인재 Pool),LG유플러스 3.8 서울,,"Science를 위한 언어(R/ Python) 및 Tool(scikit-learn/Tensorflow 등) 능숙자 . Deep Learning Model 구현 경험자 . Java, Python등을 이용하여 분석을 위한 Data..."
https://kr.indeed.com/viewjob?jk=267f8fc035be4470,(주)엘솔루 R&D본부 ASR팀 개발직,㈜엘솔루 서울,,"제공 [필수사항] ㆍ프로그래밍에 재능 및 열정이 있는 자 ㆍJava, Python 중 하나 이상의 언어사용자 ㆍWeb 개발능력 ㆍ리눅스 사용 경험자... 머신러닝(ML)|인터넷·IT·통신·모바일·게임>응용프로그래머> Python"
https://kr.indeed.com/viewjob?jk=c8bf4fa58999927f,AI 분야 박사 신입/경력,LG CNS 3.7 서울특별시,,"이상 (AI 관련 논문 발표) ② AI/딥러닝 알고리즘 연구개발 프로젝트 경험 ③ Ubuntu Linux, Python, Tensorflow, PyTorch 사용 중상급 이상 우대사항(해당 내용 중 1개 이상) ① AI/머신..."
https://kr.indeed.com/viewjob?jk=3cf01580ba5eb23a,NLP Researcher,AITRICS 서울,,"Stacks [Back-end] Language: python, golang Python Framework: Django, Bottle [Front... Language: python, golang Python Framework..."
https://kr.indeed.com/viewjob?jk=d31ab9cefeeef71b,[최고인기과정] 게임 각 분야 국비지원 교육 참여자,SGA 서울게임아카데미 서울 종로구,,백엔드|인터넷·IT·통신·모바일·게임>웹프로그래머>프론트엔드|인터넷·IT·통신·모바일·게임>웹프로그래머> Python|인터넷·IT·통신·모바일·게임>응용프로그래머>C·C++|인터넷·IT·통신·모바일·게임>응용프로그래머>JAVA...
https://kr.indeed.com/viewjob?jk=9a818d9d91db847d,Data Analytics SA,Amazon Web Services Korea LLC 서울,,"some relevant languages, tools and frameworks (e.g python, Java, R, scala, spark, Kafka, Hadoop ecosystem, presto, Hive..."
https://kr.indeed.com/viewjob?jk=18f62dc644a89e0c,2021 Global Data Internship - Seoul (Kor...,Bloomberg 서울,,"work experience using one or more programming language (e.g. Python, JavaScript, SQL, etc.) Prior coursework or involvement..."
https://kr.indeed.com/viewjob?jk=e9ac1a8708b8e784,[상시 ] Data Scientist (대리급/과-차장급/정규직),라이나생명보험 서울 종로구,,"데이터 분석 프로젝트 수행 경험 3년 이상 3년 이상의 R, SQL, Python 등 프로그래밍 언어 활용 경험 최신 AI 관련 기술을 포함한 다양한... 수행 경험 7년 이상의 R, SQL, Python 등 프로그래밍 언어 활용..."
https://kr.indeed.com/viewjob?jk=2054288dc83a5a88,[진행중]우리은행 AI사업부 전문직(인공지능(AI) 모델링) 채용공고,우리은행 4.5 서울 회현동,,"서비스 기획 경험자 - Tensorflow, Pytorch 등 머신러닝 도구 활용 역량 보유 - Python, R 등 프로그래밍 활용 역량 보유 - 은행, 카드, 보험 등 금융 분야 프로젝트 경험자 우대사항..."
https://kr.indeed.com/viewjob?jk=ee2cad5a4861601b,[이마트24] [Data Scientist] 경력사원 모집(Senior),신세계 4.5 대한민국,,"Data 분석 관련업무 최소 5년 이상(과장/대리급) - 통계/분석 관련업무 수행역량 보유자 - R, Python, SQL 등 통계/분석 프로그램 활용역량 및 Machine Learning/Deep Learning..."
https://kr.indeed.com/viewjob?jk=7cb5c3076d1701db,"Field Applications Engineer, Audio",Dolby 서울,,"High level or detailed knowledge of SOC design. C/C++, python coding skills. Knowledge of music, audio/video production..."
https://kr.indeed.com/viewjob?jk=2b09f13b5790dd69,2021년 한화시스템 방산부문 프로젝트/기간제 엔지니어 채용(상시),한화그룹 4.2 서울,,분야 경험자 [우대 요건] 무인기 GCS 개발 유경험자 SW시험/분석 도구 개발 유경험자 C/C++/C#/ Python/JAVA 프로그래밍 숙련자 0명 판교 한화인1:1문의하기 활용 지휘통제-SW 계약기간 : 입사 시...
https://kr.indeed.com/viewjob?jk=9d4dcd9b1c3270c8,RF SW Engineer,Qualcomm CDMA Technologies (Korea) YH 서울,,programming skill in C/C++ - Visual C++ / Java / Python programming skill is plus - Strong experience in RF software...
https://kr.indeed.com/viewjob?jk=444320d2e49672dc,"Application Engineer South Korea (Physics, EE)",Zurich Instruments 대한민국,,"Experience in programming languages LabVIEW, MATLAB, Python or C is a plus. Availability to travel, around 25%. Moreover, we..."
https://kr.indeed.com/viewjob?jk=1d2b22a2bcd3256f,[AI/Lab] AI 백엔드 엔지니어 (마케팅 분야),버즈니 서울,,"으로 마케팅 인사이트 도출 – 보유하고 있는 빅 데이터를 활용하여 마케팅 인사이트 도출 이런 분을 찾습니다 Python 프로그래밍에 능숙하신 분 DB, 통계, 컴퓨터 기반 기술에 대한 이해를 가지신 분 이런 분은 더욱 좋습니..."
https://kr.indeed.com/viewjob?jk=d4c52ba1a491a8b9,현대무벡스 경력사원 상시,현대무벡스 서울 종로구,,PM>웹기획|인터넷·IT·통신·모바일·게임>웹프로그래머>JAVA|인터넷·IT·통신·모바일·게임>웹프로그래머> Python|인터넷·IT·통신·모바일·게임>네트워크·서버·보안>정보보안|인터넷·IT·통신·모바일·게임>응용프로그래머>클라우드
https://kr.indeed.com/viewjob?jk=b1376913a965e740,Machine Learning Software Engineer - Emb...,Qualcomm Korea YH 서울,,related field. - Proficiency in C/C++ programming. - Python programming. - Basic knowledge of machine learning and deep...
https://kr.indeed.com/viewjob?jk=5e2d31fd9dd2ae62,대기업 영상처리 관련 IP 개발자 (판교),인파트너스 서울,,"Mentor Catapult HLS Tool 경험자 - Python 가능 [근무부서 및 직급/직책] 직급/직책: 대리, 과장, 차장 [자격요건] 경력... 게임>빅데이터·AI(인공지능)> Python|인터넷·IT·통신·모바일·게임..."
https://kr.indeed.com/viewjob?jk=166aa0c72e94a266,Business Data Analyst,Soomgo 서울 강남구,,"즈니스에 적용하고 개선한 경험 (Google Optimize, Optimizely, 등) 우대사항 • Python 또는 R 을 사용하여 데이터 분석에 활용 가능 • 경영학, 통계학, 경제학, data analysis 등..."
https://kr.indeed.com/viewjob?jk=01296857655fc85f,(주)신세계아이앤씨 AI/클라우드 부문 상시,신세계아이앤씨 서울 중구,,"험자 -. Programming : Python, Java, Node.js... 구축 프로젝트 PM or AA 경험자 -. Programming : Python, Java, Node.js, Ruby, .NET, Scala ※ 상기..."
https://kr.indeed.com/viewjob?jk=4f319862856fe9c1,"Software Engineer, Machine Learning",Google 4.3 서울,,Machine Learning or AI. Programming experience in C++ and Python. Preferred qualifications: PhD or equivalent experience...
https://kr.indeed.com/viewjob?jk=ee6d176505ffa343,전장 개발 엔지니어,가오콘 서울 강서구,,"니다. 다만 경험이 없으시더라도 C/C++고급 능력을 바탕으로 Java, Python,Json에 익숙하신 분이라면 무리없이 적응하실 수 있으니 과감하게... 기반 , Java/Json/ Python/Xml 개발 경력자 [특별우대..."
https://kr.indeed.com/viewjob?jk=75291751255b54e3,Business Analyst (Coupang Eats),Coupang 2.9 서울,,"business degree (MS or MBA) Business-level experience with Python as a plus Previous experience in e-commerce, food delivery..."
https://kr.indeed.com/viewjob?jk=ffd9cedb23e97344,파이썬SW 금융분야 특화 챗봇 개발 함께 할 엔지니어,파운트 서울 충정로역,,"처리 과정을 Python language로 구현 - Big data 처리를 위한 SW 개발 - Backend SW 구현, Messenger interface, DBMS I/F 구현 Requirement - Python..."
https://kr.indeed.com/viewjob?jk=d6c05c588971df5a,백엔드 파운트 시스템 엔지니어 (현재 급여수준 이상 보장),파운트 서울 충정로역,,"경험 - Linux명령어 및shell스크립트 작성 능숙 우대사항 - Python, Java등을 이용한 프로그래밍 경험 네트워크및 서버에 대한 표준화... 립트 작성 능숙 우대사항 - Python, Java등을 이용한 프로그래..."
https://kr.indeed.com/viewjob?jk=aa4f54d9c677fd73,인프라보안,NHN 4.4 성남 판교역,,"영역별 취약점에 대한 충분한 이해 - CVE 보안취약점 분석 및 대응 역량 - C, Java, Python 등을 통한 업무 자동화 및 분석도구 개발 경험 - 리버스 엔지니어링에 능숙하거나 다수의 버그바..."
https://kr.indeed.com/viewjob?jk=82d3ee89cf6b7fb3,[Biz] 광고 공통플랫폼 Data Engineer/DMP Enginee...,네이버 서울,,"Kotlin, Java, Scala, Python 중 1개 이상의 언어를... Engineering [자격요건] - Jav a, Scala, Python 등의 언어를 활용한 소프트웨어 개발 역량 - 리눅스 환경에서의 시스템..."
https://kr.indeed.com/viewjob?jk=bf908061bb75a00a,블록체인 시스템 엔지니어 양성과정 교육생,에프앤이노에듀 서울,,게임>웹프로그래머>백엔드|인터넷·IT·통신·모바일·게임>웹프로그래머> Python|인터넷·IT·통신·모바일·게임>응용프로그래머>C#|인터넷·IT·통신... 게임>빅데이터·AI(인공지능)> Python|인터넷·IT·통신·모바일·게임...
https://kr.indeed.com/viewjob?jk=241ae1e7499c461c,Security Engineer (모의해킹/취약점 점검),Toss 서울 강남구,,"그바운트 경험이 있는 분 - 해킹대회 우승 경력이 있는 분 - 다양한 플랫폼 보안 진단 경험이 있는 분 - Python, C, C++, C#, JAVA 중 프로그래밍 언어에 능숙 하신 분 # 현업 인터뷰 - 결제 산업의 미래..."
https://kr.indeed.com/viewjob?jk=60d03da8a3724068,이공계 전문기술 연수사업 수강생,경기도경제과학진흥원 서울,,용프로그래머> Python|인터넷·IT·통신·모바일·게임>웹프로그래머>JAVA|인터넷·IT·통신·모바일·게임>웹프로그래머> Python|인터넷·IT·통신·모바일·게임>빅데이터·AI(인공지능)> Python|인터넷·IT·통신·모바일...
https://kr.indeed.com/viewjob?jk=fb13a51ba8d08591,[Clova CIC] 클로바노트 서비스 및 음성인식 엔진 개발자 (경력),네이버 서울,,"처리: Kafka, HBase, ElasticSearch, MySQL, Kibana - 언어: C/C++, Python, Go • 클로바노트 서비스 개발(FE) - Javascript(최소 ES6 이상)/Typescript..."
https://kr.indeed.com/viewjob?jk=a265257ef8d49b1c,디지털 부문 경력사원,지투알 서울,,"자 - 데이터 분석 툴(Adobe Analytics 또는 Google Analytics) 유경험자 우대 - Python, R, SQL 역량 보유자 우대 - 데이터에 기반한 문제해결 능력 및 통계학적 지식 보유자 우대 업무내용..."
https://kr.indeed.com/viewjob?jk=ba7966a3fe799433,[지원하자규] (주)규의 유능한 프로그래머,규 대한민국,,그래머>웹개발|인터넷·IT·통신·모바일·게임>웹프로그래머>HDML|인터넷·IT·통신·모바일·게임>웹프로그래머> Python|인터넷·IT·통신·모바일·게임>웹프로그래머>JAVA|인터넷·IT·통신·모바일·게임>웹프로그래머>HTML...
https://kr.indeed.com/viewjob?jk=7d4bc2a107c6669b,Customer Engineer,Microsoft 4.2 서울,,least 5 years welcome experience in model development using python or R. Experience in migrating from one database to another...
https://kr.indeed.com/viewjob?jk=c8d13289019f260f,[어니컴(주)] 데이터 분석가 신입/경력,어니컴 서울 용산구,,프로그래밍 언어: R 혹은 Python 활용 가능 - 통계 또는 기계학습에... 데이터분석|인터넷·IT·통신·모바일·게임>빅데이터·AI(인공지능)> Python|인터넷·IT·통신·모바일·게임>빅데이터·AI(인공지능)>R|인터넷...
https://kr.indeed.com/viewjob?jk=18ed6f92a291d134,Sr. Manager for Logistics digital transf...,Thermo Fisher Scientific 3.5 서울,,"Excel (VBA, power pivots) skills - Experience in R studio, Python, data modeling, and hypothesis testing is a plus - Must..."
https://kr.indeed.com/viewjob?jk=8af26b37623864c4,8퍼센트 개발자 (신입/경력),8퍼센트 서울 종로구,,개발 금융 데이터 분석과 분석 플랫폼 운영 자격요건 컴퓨터 전공자 또는 웹 개발 경력 1년 이상 우대사항 Python 코드를 무리 없이 읽으실 수 있는 분 Linux/Mac 사용 가능한 분 새로운 기술에 대한 호기심을 가지신...
https://kr.indeed.com/viewjob?jk=eeb9fe1c361f0758,정보보안 담당자,Nexon 성남 분당구,,보안 이벤트 분석 또는 상관관계 이벤트 분석 능력 보유 - OS 및 네트워크 관련 기초 지식 보유 - python 등의 간단한 스크립트 작성 능력보유 - 타인과의 원활한 커뮤니케이션 자세 - 새로운 기술에 대한 적극적...
https://kr.indeed.com/viewjob?jk=8df90eafac846fc5,[Search] 분산 데이터 저장 플랫폼 BE 개발 신입/경력사원,네이버 서울,,"및 인터페이스 개발 [자격요건] · C S 관련 탄탄한 기본기를 바탕으로 습득이 빠르신 분 · Bash/ Python 중 1 개 , C/C++/Java 중 1 개 이상의 언어로 개발 가능 · 리눅스 환경에서 개발 경험 및..."
https://kr.indeed.com/viewjob?jk=d143cbffed5f5411,[Search] 클라우드 AI 플랫폼 BE 개발 신입/경력사원,네이버 서울,,신러닝 플랫폼 개발 [자격요건] · CS 관련 탄탄한 기본기를 바탕으로 습득이 빠르신 분 · Java / Python / Go 언어 중 1 개 이상의 언어로 개발이 가능한 분 · 리눅스 환경에서 개발이 가능하신 분 [우대...
