Link,Title,Location,Salary,Summary
https://kr.indeed.com/viewjob?jk=e63688ba2c2a4eb8,동국대학교 자율사물(AT)사업단 직원 채용,동국대학교 4.3 서울 필동,,5. 본교 건학이념인 불교정신을 이해하고 그 신앙생활에 동참하는 자 6. ROS 또는 동급 플랫폼 및 Python 프로그램 가능자 우대 7. 주행 및 드론 등 컴퓨터 비전 기반 제어 경험자 우대 2. 근무 시간: 09시...
https://kr.indeed.com/viewjob?jk=2d86a39d779f0631,인프라 엔지니어,RIDI Corp 서울,,"키텍처 구성 경험이 있으신 분 Docker, ECS, K8S 등 컨테이너 기반의 서비스 운영 경험이 있으신 분 Python, Node.js, Typescript, GO 등 프로그래밍 경험이 있으신 분 우대사항 Docker..."
https://kr.indeed.com/viewjob?jk=07375dc4e800dfa9,추천 시스템 소프트웨어 엔지니어,카카오 4.0 성남 판교역,,"관련 업무 경험자 우대사항 운영체제, 네트워크, 컴파일러, 데이터베이스에 대한 이해가 깊으신 분 Python, C++, GPU 프로그래밍 숙련자 대용량/실시간 서비스 개발/운영 경험이 많으신 분 ICPC/TopCoder..."
https://kr.indeed.com/viewjob?jk=7dfbf378267bf0b0,Physicist or Engineer (m/f/d) as System...,pmdtechnologies 서울,,PhD graduate) Well-founded knowledge and safe handling of Python Experience... field of data analysis Basic knowledge...
https://kr.indeed.com/viewjob?jk=092d062a6faa7139,데이터 분석가 모집,카카오 4.0 성남 판교역,,"이터 분석 지원자격 데이터 분석 업무를 수행할 수 있는 하나 이상의 언어 스킬 필수 (예. SQL, Python, R 등) 데이터 기반 프로젝트 경험이 있으신 분 (예: 통계 분석 프로젝트) 어떤 일이라도 중요하게 여기..."
https://kr.indeed.com/viewjob?jk=447e5726f229a2b7,"Cloud Technical Solutions Engineer, Netw...",Google 4.3 서울,,"reading or debugging code (e.g., Java, C, C++, .NET, Python, Shell, Perl, JavaScript). Experience advocating for customer..."
https://kr.indeed.com/viewjob?jk=72abb40412824104,Account Executive - Korea,Mistplay 서울,,analytical approach to problem-solving. Experience with SQL / Python / VBA is a plus. Experience with Photoshop is a plus. We...
https://kr.indeed.com/viewjob?jk=710f22d8cfcebf4f,[긴급] 빅데이터 플랫폼 개발에 관심있는 신입/경력 직원,타임소프트 서울 금천구,,"Scala, Python, Java, AI (NLP) 3. AI 기반 경력자 모집분야 : 자연어(NLP), 음성 AI 언어 : 리눅스환경 활용 중급이상(OS, SHELL), Java, Scala, Python [우대조건..."
https://kr.indeed.com/viewjob?jk=da5c549bf1a76ded,데이터 사이언스(데이터 모델링 및 추천 모델링),NHN 4.4 성남 판교역,,"AB테스트, 결과 해석 등) - 리눅스 환경에서 머신 러닝 및 데이터 분석 관련 언어, 라이브러리( Python, R, SQL, tensorflow 등) 능숙한 활용 - 머신러닝, 추천 , 딥러닝 관련 논문을..."
https://kr.indeed.com/viewjob?jk=94d3cbb8df6dd32c,(화학대기업) IT기획 및 운영,화인크루 성남 분당구,,JAVA|인터넷·IT·통신·모바일·게임>웹프로그래머>PHP |인터넷·IT·통신·모바일·게임>웹프로그래머> Python|인터넷·IT·통신·모바일·게임>웹프로그래머>ASP.NET|인터넷·IT·통신·모바일·게임>웹프로그래머>VB.NET
https://kr.indeed.com/viewjob?jk=98569acf584e0b31,Front-end 개발자,(주)위키시큐리티 서울,,"HTML5, AngularJS, VUEJS, NODEJS, ELK Stack, GitLab/GitHub, Python o (우대) 정보통신 분야의 전문대/대학 졸업자 o (우대) 영어 쓰기/말하기/읽기/듣기 잘 하시는 분..."
https://kr.indeed.com/viewjob?jk=e5448ffc7d6ecf02,FPGA 플랫폼 엔지니어 (딥러닝 하드웨어 프로세서 개발),딥엑스 성남 분당구,,"사용 경험(Chip Scope/SignalTap) - Language: Python/Perl, C/C++ - Vivado 또는 Synplify 또는... SignalTap) - Language: Python/Perl, C/C++..."
https://kr.indeed.com/viewjob?jk=ee81b6e3bdfd44fd,[촉탁직] 법률AI Software Engineer 경력,SK 씨앤씨 4.0 서울,,경험 2년이상 역량/스킬 java/spring based web application programming python programming rpa programming (opensourceq- orsolution) ocr...
https://kr.indeed.com/viewjob?jk=cecd7fddf9f885ee,[Altair Korea/ 외국계] CFD Engineer,알테어엔지니어링 성남 분당구,,"이상) ㆍ기계공학 혹은 유관학과 전공자 [우대사항] ㆍ프로그래밍 언어(C, Python) 사용 가능자 ㆍ상용 CFD(STAR-CCM+, FLUENT... 로그래머>C·C++|인터넷·IT·통신·모바일·게임>웹프로그래머> Python"
https://kr.indeed.com/viewjob?jk=7268328c0d71d81c,Junior Full-Stack Developer,Asiance 서울,,"React 혹은 WordPress 등의 CMS도 사용. • Python, Node.js, Java, PHP for backend development. • Python, Node.js, Java, PHP 등을 사용하여 백엔드..."
https://kr.indeed.com/viewjob?jk=5e8ec655651dac9a,Cloud Infrastructure Developer,SAP 4.3 서울,,Your tasks will include developing a python based scalable job execution platform... development with Python Experience...
https://kr.indeed.com/viewjob?jk=be6c1f03fa566f8e,추천 시스템 연구/개발,카카오 4.0 성남 판교역,,"관련 분야 석사 및 박사 학위 소지자 적어도 하나 이상의 능숙한 프로그래밍 언어가 있으신 분 우대사항 Python, C++, GPU 프로그래밍 숙련자 TensorFlow, PyTorch, implicit 등 머신러닝..."
https://kr.indeed.com/viewjob?jk=444320d2e49672dc,"Application Engineer South Korea (Physics, EE)",Zurich Instruments 대한민국,,"Experience in programming languages LabVIEW, MATLAB, Python or C is a plus. Availability to travel, around 25%. Moreover, we..."
https://kr.indeed.com/viewjob?jk=a3a65a4d59061430,위시켓과 함께할 서버개발자님,위시켓 서울 강남구,,"를 활용한 정적 페이지 연계 - Docker, Jenkins 등을 활용한 CI/CD 개선 자격조건 - Python 기반의 프레임워크를 이용한 웹서비스 구축 또는 운영 경험 - Django 기반의 웹 서비스 구축 또는 운영..."
https://kr.indeed.com/viewjob?jk=674466316840f8f5,Senior Robotics Software Engineer,Bear Robotics 서울,,"related field Proficiency in Linux Experts in C++ and Python Preferred Experience: ROS, navigation stack Passion for robots..."
https://kr.indeed.com/viewjob?jk=87837b22b2d66b12,[Search] 동영상 검색 백엔드 개발 신입/경력,네이버 서울,,"피드백 정제 · 동영상검색 모델링 개선 · 관련검색어, 관련동영상 등 추천 기술 개발 [ 자격요건 ] · Python, C++, Scala, Java, Golang 등의 백엔드 개발 언어를 2개 이상 자유롭게 활용 가능하신..."
https://kr.indeed.com/viewjob?jk=11e4f0710d52e762,Product Service Expert,Nova Measuring Instruments 경기도 화성,,"SEMI E10, SPC, TRIZ, structured problem solving, DOE, JMP, Python, and data analysis—an advantage Ability to travel—30..."
https://kr.indeed.com/viewjob?jk=a4ade495ab488c6f,사물인터넷(IoT) 개발자 (하드웨어 및 소프트웨어),큐빅스 경기도 파주,,통신·모바일·게임>시스템프로그래머>임베디드(Embedded)|인터넷·IT·통신·모바일·게임>응용프로그래머> Python|인터넷·IT·통신·모바일·게임>응용프로그래머>JAVA|인터넷·IT·통신·모바일·게임>응용프로그래머>자바스크...
https://kr.indeed.com/viewjob?jk=7639fede84396f4a,"하드웨어, 소프트웨어 외 신입/경력 정규직",유닉트 경기도 양주,,"studio code - xcode 서버개발 * 서버 개발 ( Python 3, Django) - visual studio code - AWS EC2... 통신·모바일·게임>응용프로그래머> Python|인터넷·IT·통신·모바일·게임..."
https://kr.indeed.com/viewjob?jk=7439487de17e51ee,"21년 1분기 기술연구소(S/W, H/W, F/W, FPGA 개발) 채용...",큐알티 이천 부발읍,,"장비의 S/W, H/W, F/W, FPGA 개발 [역량... W 및 H/W 직군(C, C++, C#, python 등 프로그래밍 언어 필수), FPGA(VDHL, Verilog에 대한 이해 필수), H/W..."
https://kr.indeed.com/viewjob?jk=444320d2e49672dc,"Application Engineer South Korea (Physics, EE)",Zurich Instruments 대한민국,,"Experience in programming languages LabVIEW, MATLAB, Python or C is a plus. Availability to travel, around 25%. Moreover, we..."
https://kr.indeed.com/viewjob?jk=34fa532c14506bb9,빅데이터·AI 기반 산업 혁신인재 양성 및 고용 [참여청년 추가 ],재단법인 부산정보산업진흥원 부산 해운대구,,통신·모바일·게임>빅데이터·AI(인공지능)>데이터분석|인터넷·IT·통신·모바일·게임>빅데이터·AI(인공지능)> Python|인터넷·IT·통신·모바일·게임>빅데이터·AI(인공지능)>머신러닝|인터넷·IT·통신·모바일·게임>빅데이터...
https://kr.indeed.com/viewjob?jk=206550813b58865d,[개발자] 꿈 찾아드립니다. 저희와 함께하세요,ICON 서울 강남구,,Python (신입/경력)개발자 (1명) - 이미지 프로세싱 관련 개발 경험이 있으신 분 - OpenCV 를 이용한 C++ 혹은 Python 개발에... 통신·모바일·게임>웹프로그래머> Python|인터넷·IT·통신·모바일·게임...
https://kr.indeed.com/viewjob?jk=5efc4afdac9d87aa,AI/딥러닝기반 머신비전 비전센터 상반기 공개,유토시스 경기도 화성,,"상처리응용S/W -. 딥러닝 모델링 [자격요건] -. 학력 : 대졸이상 -. MFC, C++, C# 또는 Python 경험자 -. 딥러닝 알고리즘 개발 경험자 -. 국내/외 출장 가능자 [우대사항] -. 수학/물리/통계/컴퓨..."
https://kr.indeed.com/viewjob?jk=78f5465432356e17,Sr Systems Administrator I,Raytheon Intelligence & Space 대한민국,,"Experience with Linux/Unix scripting, C++, Java, Perl, Python, Sybase... SQL. - Experience with Linux/Unix tools, YUM..."
https://kr.indeed.com/viewjob?jk=ca0306392b156e54,데이터 사이언티스트 초빙,에이치앤티어세스 서울 서초구,,"통해 비즈니스와 기술 적용의 기회를 발굴할 수 있는 분 ㄷ. SQL, Python /R , Tableau등으로 데이터 분석 업무를 수행할 수 있는 분... 게임>빅데이터·AI(인공지능)> Python|마케팅·광고·홍보·조사>마케팅>마케팅기획"
https://kr.indeed.com/viewjob?jk=752a4b5d63eac97c,Back-end Engineer (Python),Soomgo 서울 강남구,,숨고의 백엔드 엔지니어( Python)는 숨고의 기반 기술을 담당하는 매우... 5년 이상의 웹/앱 서비스 백엔드 시스템 개발 경험이 있는 분 • Python 언어를 활용한 개발 경험이 있는 분 • 성능 최적화에 대해 지속적으로...
https://kr.indeed.com/viewjob?jk=f5f5f902d240ac96,Data Scientist,Toss 서울 강남구,,"또는 실무 경험 5년 이상 갖춘 분 - 실제 서비스 데이터를 이용한 분석모델 개발 경험이 있는 분 - R, Python, Scala, SQL 등 데이터 분석의 업무를 수행할 수 있는 하나 이상의 개발 언어에 능숙한 분 #..."
https://kr.indeed.com/viewjob?jk=f565607a390f8b13,[헥스콘] 2021년 상반기 백엔드 서버 개발자,헥스콘 창원 의창구,,"기술스택] 1) 사용언어 : Java, Kotlin, C++, HTML, CSS, Swift, Object-C, Python, Php, Node.js 2) 사용DB : MySQL, MSSQL, Maria DB, Oracle..."
https://kr.indeed.com/viewjob?jk=44c01463235ebade,[전문연구요원] 빅데이터 엔지니어(신입/경력),웹젠 성남 분당구,,통합 과정 수료자 포함)로서 전문연구요원 신규편입/전직 대상인 분 - Python 또는 C# 프로그래밍 능력을 보유한 분 - Linux 환경에서 개발... 요원 신규편입/전직 대상인 분 - Python 또는 C# 프로그래밍 능력을...
https://kr.indeed.com/viewjob?jk=0f7f6cd1af719bb0,[Search] 검색 서버 개발 & DevOps 엔지니어 경력사원,네이버 서울,,"운영 환경에 대한 경험이 있으신 분 - 분산 시스템에 대한 기본적인 이해가 있으신 분 - C++, Go, Python 등 프로그래밍 언어에 하나 이상 능숙하신 분 [우대 요건] - 대용량 데이터 및 트래픽 처리 경험이..."
https://kr.indeed.com/viewjob?jk=33e339e37a9a3699,"(대전) 국방 M&S 연구분석관(통계, 연구분석 등)",심네트 대전 유성구,,통신·모바일·게임>빅데이터·AI(인공지능)>R|인터넷·IT·통신·모바일·게임>빅데이터·AI(인공지능)> Python|인터넷·IT·통신·모바일·게임>전산·IT기술지원>IT기술지원|인터넷·IT·통신·모바일·게임>전산·IT기술지원...
https://kr.indeed.com/viewjob?jk=96688eea9c1a9e28,Security Engineer (취약점 분석),Toss 서울 강남구,,"# 자격 요건 - 모의해킹 및 취약점 점검 경력이 있는 분 - 소스 코드 정적 취약점 점검에 능숙한 분 - Python, C, C++, JAVA 중 프로그래밍 언어에 능숙한 분 # 우대 사항 - 국내 또는 국외 버그 바운티..."
https://kr.indeed.com/viewjob?jk=99fff6b8c3d20d8b,국내 메이저 건설사 건설업 로보틱스/자율주행 전문 개발 포지션 ASAP,국내 메이저 건설사 건설업 로보틱스/자율주행 전문 개발 포지션 ASAP 서울 종로구,,"유자 - LIDAR, Vision 센싱 프로그램 활용 가능자 • 우대사항 - 컴퓨터 프로그래밍 가능자 ( Python, C++, C# 등) - ROS 프로그래밍/Manipulation PJT 경험자 근무 형태: 정규직..."
https://kr.indeed.com/viewjob?jk=ef05281bd02652a8,Data Analyst,Toss 서울 강남구,,"소지하신 분 혹은 경험이 풍부하신 분 - Data Warehouse 구축 지식이나 경험이 있으신 분 - Python, R, Spark 등 언어 및 데이터 프로세싱 프레임워크에 대한 이해도가 높은 분 - 필요한 데이터를 스스로..."
https://kr.indeed.com/viewjob?jk=917cc06120add6e1,Data Scientist,Soomgo 서울 강남구,,년 이상 경력자 • Stakeholder와의 원활한 커뮤니케이션 능력 • SQL 능숙하게 활용 가능한 분 • Python을 활용한 수학적 통계 분석 및 모델링 가능한 분 • 다양한 머신러닝 알고리즘을 적재적소에 활용해본 경험...
https://kr.indeed.com/viewjob?jk=9a79000f44a1e214,"Manager Consumer Data Seoul, South Korea...",Philip Morris International 4.2 서울,,"functions • Significant proficiency in SQL, R... Python • Proficient user of MS Power Pivot, Power View, Power BI..."
https://kr.indeed.com/viewjob?jk=7af54571a6a84047,Assistant Professor of Computational and...,George Mason University Korea 인천 송도동,,"have experience in teaching with R, Python, Matlab, Fortran, and MySQL... teaching with R, Python, Matlab, Fortran..."
https://kr.indeed.com/viewjob?jk=8f05cfefa5f42b14,Data Science 컨설턴트 - 글로벌 컨설팅펌,에스에프인촌 서울 서초구,,"분석 등을 통한 Insight 도출 자격요건 통계학과/산업공학과/컴퓨터공학과 등 유관 학과 졸업/석박사 우대 Python 등 관련 코딩 경력 빅데이터, 통계, Machine Learning, 알고리즘 등 Artificial..."
https://kr.indeed.com/viewjob?jk=41e5243f2bcdb856,[어니컴(주)] 웹 응용 프로그램 / 빅데이터 기계학습 알고리즘 개발자,어니컴 서울 용산구,,경험(개발언어: Java 혹은 Python) - 데이터베이스 활용(수준... Azure와 같은 클라우드 환경에서의 구축 경험 ㆍ Python 활용능력 혹은 Python 기반 프로젝트 수행 경험 ㆍ대용량 처리 시스템(Hadoop...
https://kr.indeed.com/viewjob?jk=66d8a42fa933e7d0,2021년 상반기 정보보안 엔지니어 - 취약점파트,인섹시큐리티 서울 금천구,,10에 대한 설명과 구현/조치 가능 - 국내 컴플라이언스 대응 경험 (주요정보통신기반시설 가이드 등) - Python 활용자 - Kali 및 Metasploit 경험자 * 자격요건과 우대사항은 필수가 아닙니다. 0 명 근무조...
https://kr.indeed.com/viewjob?jk=47c7c977efff92f8,Digital Executive/Analyst,ForwardPMX 서울,,"experience or education in Digital marketing Knowledge of python, sql Apply Now at Mustakbil.com... job was originally..."
https://kr.indeed.com/viewjob?jk=3648b34c0ad44f26,"[펜타시큐리티] 보안S/W 개발 및 기획자 (웹, 인증, 블록체인)",펜타시큐리티시스템 서울 영등포구,,인터넷·IT·통신·모바일·게임>웹프로그래머>JAVA|인터넷·IT·통신·모바일·게임>웹프로그래머> Python|인터넷·IT·통신·모바일·게임>응용프로그래머>C·C++|인터넷·IT·통신·모바일·게임>응용프로그래머>JAVA|인터넷...
https://kr.indeed.com/viewjob?jk=12c2c75d4f3ac682,"인공지는 연구원(딥러닝, 컴퓨터 비젼)",디비엔텍 인천 서구,,[직무내용] 1.딥러닝 기반 객체인식 모듈 연구개발 (Tensorflow / Python) 2.영상 전/후 처리 모듈 연구개발 (OpenCV 등 활용) 3.객체추적(Object Tracking) 모듈 연구 개발 [근무시간 및...
https://kr.indeed.com/viewjob?jk=e77aa802761fd34d,혁신성장 클라우드 아카데미 4기 교육생,한국클라우드컴퓨팅연구조합 서울,,로그래머>가상현실(VR)|인터넷·IT·통신·모바일·게임>응용프로그래머> Python|인터넷·IT·통신·모바일·게임>웹프로그래머>ASP|인터넷·IT·통신... 통신·모바일·게임>웹프로그래머> Python|인터넷·IT·통신·모바일·게임...
https://kr.indeed.com/viewjob?jk=ae5283196d38f489,"영상처리, 머신비전, 장비제어 비전센터 상반기 공개",유토시스 경기도 화성,,"응용 S/W개발 -. 운영/제어 개발 [자격요건] -. 학력 : 대졸이상 -. MFC, C++, C# 또는 Python 경험자 -. Windows기반 UI 프로그램 개발 경험자 -. 영상처리 알고리즘 개발 경험자 -. 검사장..."
https://kr.indeed.com/viewjob?jk=385761a6f14de7c6,데이터분석가,RIDI Corp 서울,,"데이터에 기반한 사고 능력 통계 기본 지식 및 모델링에 대한 이해와 활용 가능 데이터 처리 언어 (R, Python, Scala) 사용 경험 우대사항 리디 서비스 사용 경험 통계 모델링 또는 머신러닝 경험 데이터 시각화..."
https://kr.indeed.com/viewjob?jk=9c4f4236ac42f224,DBA 엔지니어,쏘카 대한민국,,"시계열 데이터베이스(InfluxDB) 구축 운영 경험이 있으신 분 • 자동화를 위한 스크립트 (Shell, Python, Ansible) 지식을 보유하신 분 • 새로운 기술 도입에 대한 오픈 마인드를 가지고 계신 분 전형절차..."
https://kr.indeed.com/viewjob?jk=91aa3bd221ee815b,AI Service Planning/Business Development,AITRICS 서울,,"Stacks [Back-end] Language: python, golang Python Framework: Django, Bottle [Front... Language: python, golang Python Framework..."
https://kr.indeed.com/viewjob?jk=464ef95516a5fa5c,8퍼센트 경력 개발자,8퍼센트 서울 종로구,,"개발업무 - 금융 서비스 개발 - Python/Django 기반 - 정해진 역할이 아닌 기능에 따른 업무 분배 - 프로트엔드부터 백엔드까지 업무 범위... SQL 기본 - git flow - python, django 경험자 우대"
https://kr.indeed.com/viewjob?jk=d69b5a1e60c65ce6,데이터 마케팅 경력사원,LG전자 3.8 서울 영등포구,,"경험 보유자 - 통계/개발 Tool 활용 능력 보유자 (SQL, R, Python, Scalar, Hadoop 등) 3) 우대 사항 - 높은 통계... 운영 경험자 - SQL, R, Python 등 통계 패키지 활용 자격증..."
https://kr.indeed.com/viewjob?jk=f82b428f076301bc,Data analytics & Ad Operations manager,Dentsu Aegis Network 서울,,Branch c. Programming language experience... R or Python and SQL 6. Diligent... strong attention to detail 7...
https://kr.indeed.com/viewjob?jk=23a1ef56cec26ba1,정보기획 경력 - 2021030201,커리어포커스 서울,,"대졸(4년제) 이상 2) 경력 : 3년~15년 : - 대외정보 수집, DB분석 및 정보화 경력 - R Python 및 분석 Tool 사용 가능자 - 빅데이터 분석 및 빅데이터분석 관련 자격증 우대 5. 근무부서 및..."
https://kr.indeed.com/viewjob?jk=24a2513486b6daf6,[Creative] Technical Artist,PUBG 서울,,"숙련도 및 지식 - 시네마틱 영상 관련 제작 경험 또는 지식 - 캐릭터 리깅 가능 - C++ 활용 능력, python활용 능력 - MAYA, Substance Designer 경력 등 [업무 경력] - 3년 이상 [고용..."
https://kr.indeed.com/viewjob?jk=4f2835fd73c9e3c7,Application Engineer III - (E3),Applied Materials Inc. 대한민국,,"trainer. 7. Direct experience of algorithm writing (e.g., R, Python... plus. 8. Travel to international locations at ~25..."
https://kr.indeed.com/viewjob?jk=78e99625e5de3c95,전문연구요원 (병역특례) 수시 (AI / HW 분야),딥엑스 성남 분당구,,"모델의 RTL IP 설계 및 IP 검증 가능자 - Language: Python/Perl, C/C++ [우대 조건] - ARM based SoC 설계... Linux, shell, tcl, python, perl 사용 원활..."
https://kr.indeed.com/viewjob?jk=dee1c9e840dc5691,Staff Field Application Engineer,Dolby 서울,,"Dolby’s ecosystem, products, business, and customers. Python coding skills. Interest in music, game/film audio or video..."
https://kr.indeed.com/viewjob?jk=ef17560d7d3fb8f3,2020년 각 부문 신입/경력,더이앤엠 서울,,"GCP, Azure) 경력 우대 ㆍASP, Node.js, Python, Go, PHP 등 ㆍWOWZA 스트리밍 솔루션 유경험자 ㆍ호스팅 업무 유경험... ㆍASP, Node.js, Python, Go, PHP 등 ㆍWOWZA..."
https://kr.indeed.com/viewjob?jk=9819ba37f864cc20,프로그래머 (어플리케이션 개발자 또는 웹개발자),오너클랜 서울 금천구,,인터넷·IT·통신·모바일·게임>응용프로그래머>자바스크립트|인터넷·IT·통신·모바일·게임>응용프로그래머> Python|인터넷·IT·통신·모바일·게임>응용프로그래머>C#|인터넷·IT·통신·모바일·게임>웹프로그래머>웹개발|인터넷...
https://kr.indeed.com/viewjob?jk=69ab0f58743cb713,21년 전문연구요원 (AI엔지니어),Nexon 성남 분당구,,"대상자 - 병역의무가 없거나 면제된 분, 병역의 의무를 마치신 분은 본 공고의 대상에서 제외됨 - Python에 숙련된 프로그래밍 능력과 머신러닝 라이브러리 활용 경험 - 머신러닝과 강화학습에 관련된 지식 습득 혹은..."
https://kr.indeed.com/viewjob?jk=a6357089799f9975,Deep Learning R&D Engineer,Intel 4.1 서울,,"Caffe, and MxNet Strong programming skills with C/C++ and Python Experiences on programming and testing on Linux environment..."
https://kr.indeed.com/viewjob?jk=c718580e48cf1c75,AI 비전 인식 시스템 및 아키텍쳐 설계 알고리즘 개발,국내 대기업 / 화물 운송업 / 조단위 이상 매출 기업 서울,,"제어 SW 개발 또는 구축 프로젝트 경험자 • 요구조건 - 프로그래밍 언어 활용 능력(C / C++, Python) - 주요 머신러닝 및 비전 패키지 활용 능력 - 리눅스OS 기반 개발 - 임베디드 시스템 개발 - DB..."
https://kr.indeed.com/viewjob?jk=2c4c5856662783e7,Data Analyst,IQVIA 서울,,learning / predictive modeling ) • 통계 프로그램 활용 능력 SAS / R / Python 중 최소 1가지 중급 이상의 활용능력 요구 • Communication Basic English...
https://kr.indeed.com/viewjob?jk=e7cc2dd53f8b03b7,빅데이터 분석(머신러닝/딥러닝) 컨설턴트 정규직,디앤아이컨설팅 서울 동대문구,,"석사학위자의 경우 2년 이상 경력자 ㆍ분석결과에 대한 명확한 의사소통 및 문서화 기술이 있으신 분 ㆍR, Python 등 언어를 활용한 데이터 정제, 분석, 모델링, 시각화 경험이 있으신 분 ㆍ데이터 기반 실험 및 모델을 실..."
https://kr.indeed.com/viewjob?jk=bcd2f0630e298aa3,클라우드 인프라 운영 담당자 모집,넷마블 서울 구로구,,"기술적인 문제점 파악 및 해결 스킬 우대 사항 - 유관 경력 5년 이상 - 인터프리터 언어 숙련자 ( Python, Ansible 등) - 컴퓨터 관련 전공 이수자 우대 - 네트워크 기본 역량 - 게임사/포탈 인프라..."
https://kr.indeed.com/viewjob?jk=481f953ccaa4bc96,머신러닝 개발자 모집,넷마블 서울 구로구,,"시스템 운영 효율화 및 고도화 자격요건 - ML 관련 분야 경력 6년 이상 - Cloud 서비스 활용 경험 - Python, C/C++, SQL 사용 가능 - Tensorflow 또는 상응하는 라이브러리 활용 경험 우대사항..."
https://kr.indeed.com/viewjob?jk=00c30d286ee5c97f,[충청권/50명]인공지능(AI) 기본과정+고급과정 훈련생 대,청주대학교산학협력단 청주 상당구,,19~22시 120시간 10주 인공지능 기본과정 (120h) 인공지능 Python을 이용한 기초 프로그래밍 교육 · 기초 프로그래밍 · 머신러닝 라이... 게임>빅데이터·AI(인공지능)> Python|인터넷·IT·통신·모바일·게임...
https://kr.indeed.com/viewjob?jk=8ad8f768cd99afcf,"Applications Engineer (P&R, physical des...",Synopsys 서울,,"development. Proficiency in programming and scripting (TCL, Python, Shell). Able to resolve wide range of technical issues..."
https://kr.indeed.com/viewjob?jk=ce0ded2592265e1c,데이터 엔지니어,RIDI Corp 서울,,"에서의 데이터 파이프라인 구축 및 운영 경험 GA, Tableau 등 외부 분석/시각화 도구에 대한 지식 Python, Java, Scala 중 하나 이상을 이용한 개발 경험 추가 정보 지원 서류 안내 제출서류 : 이력..."
https://kr.indeed.com/viewjob?jk=85289ba67bb1634d,[Search] 네이버/LINE 지역검색 및 추천 서비스 개발 신입/경력,네이버 서울,,문제 해결 능력이 있으신 분 · Linux 환경에서 개발 경험이 있으신 분 · C / C++ / Python / Scala / Java 중 1개 이상에 대한 활용 및 이해도가 높으신 분 [우대사항] · Tensorflow...
https://kr.indeed.com/viewjob?jk=b3891b8c405f34e6,Data Analytics 컨설턴트 - 글로벌 컨설팅Firm,에스에프인촌 서울,,본적으로 비즈니스 문제 해결이 가능한 컨설팅 자질을 갖추고 있어야 함 - Python 등 관련 코딩 경험자 우대 3) 영어 활용 능력 우수자 우대 4... 자질을 갖추고 있어야 함 - Python 등 관련 코딩 경험자 우대 3...
