Link,Title,Location,Salary,Summary
https://kr.indeed.com/viewjob?jk=444320d2e49672dc,"Application Engineer South Korea (Physics, EE)",Zurich Instruments 대한민국,,"Experience in programming languages LabVIEW, MATLAB, Python or C is a plus. Availability to travel, around 25%. Moreover, we..."
https://kr.indeed.com/viewjob?jk=4adac8923476d038,프랭클린템플턴투신운용 Junior Trader (Quant base 필수...,프랭클린템플턴투신 대한민국,,"object-oriented programming and intermediate programming proficiency in Python, R or MATLAB, and SQL are essential. Licenses..."
https://kr.indeed.com/viewjob?jk=efb69a29d8bd7514,2021년 IITP 주관 글로벌핵심인재양성 지원사업,정보통신기획평가원 대전 유성구,,인공지능)>빅데이터|인터넷·IT·통신·모바일·게임>빅데이터·AI(인공지능)>인공지능(AI)|인터넷·IT·통신·모바일·게임>빅데이터·AI(인공지능)> Python|인터넷·IT·통신·모바일·게임>빅데이터·AI(인공지능)>데이터분석
https://kr.indeed.com/viewjob?jk=649ccf047c868778,"금융 데이터 분석 엔진, 로보어드바이저 개발자",에스비씨엔 서울 영등포구,,"시스템, 머신러닝, 자연어처리. 패턴분석 - 다음 언어에서 최소 한 가지 이상 능숙자: Java, C++, Python, JavaScript 우대사항 - 석사이상 컴퓨터공학 (Computer Science) 분야 또는..."
https://kr.indeed.com/viewjob?jk=7cb5c3076d1701db,"Field Applications Engineer, Audio",Dolby 서울,,"High level or detailed knowledge of SOC design. C/C++, python coding skills. Knowledge of music, audio/video production..."
https://kr.indeed.com/viewjob?jk=3330430ae94277db,[타다]데이터 분석가/사이언티스트,쏘카 대한민국,,"통계에 대한 지식 및 머신러닝에 대한 지식을 보유하고 있으며, 데이터 분석 실무 경험이 풍부하신 분 • R, Python(Pandas, Numpy, Scikit-learn) 등의 데이터 분석을 위한 언어를 1개 이상 능숙하게..."
https://kr.indeed.com/viewjob?jk=996aed4fb9a166e0,[정규직] 금융 신규사업(AI예측기반 Data사업) 데이터 분석 전문인력,SK 씨앤씨 4.0 서울,,역량/스킬 - 금융 시장지수/가격 등 데이터에 대한 이해 - 금융/시계열 BigData/AI 분석역량(R/ Python/Tensorflow/pyTorch 등) - 개별예측모델 구축 및 앙상블 분석/최적화 역량 - Agile...
https://kr.indeed.com/viewjob?jk=7707ee30191f19c1,[지식베이스] 지식베이스 데이터 플랫폼 및 서비스 개발 경력,네이버 서울,,"시스템 사용 경험자 - Java, Python, C/C++, Scala... 경험 - k8s, docker 를 활용한 운영 경험 - Java , Python, C/C++, Scala 중 두가지 이상 숙련자 - 머신러닝 지식..."
https://kr.indeed.com/viewjob?jk=d136d5b4d86f5c61,2021 업무혁신(PI) 신입사원,LG디스플레이 3.4 경기도 파주,,"유자 우대조건 - BI(Business Intelligence) Tool 활용능력 보유자 - 통계/분석(R, Python) Tool 활용능력 보유자 담당업무 - 공정 제어 PI (공정 변동 관리 업무) 필수조건 - 산업공학..."
https://kr.indeed.com/viewjob?jk=e157aa3d21a2a1be,대학경쟁력연구원 연구직계약직원(계약직),아주대학교 3.8 수원 영통구,,"원자격  필수사항 : 석사학위 또는 박사학위 소지자  우대사항 - 데이터 분석 관련 전공자 - R, Python, SQL, Excel 등을 이용한 데이터 분석 가능자 - 시각화 툴 사용능력 및 정량적/정성적 분석..."
https://kr.indeed.com/viewjob?jk=112e58d399a83a19,BIM Manager,SYSTRA 서울,,"Openroads, Navigator. Microsoft: Office 365. IT language: Python (A plus) Others: Dynamo (A plus) Job Segment: Engineer..."
https://kr.indeed.com/viewjob?jk=d4c52ba1a491a8b9,현대무벡스 경력사원 상시,현대무벡스 서울 종로구,,PM>웹기획|인터넷·IT·통신·모바일·게임>웹프로그래머>JAVA|인터넷·IT·통신·모바일·게임>웹프로그래머> Python|인터넷·IT·통신·모바일·게임>네트워크·서버·보안>정보보안|인터넷·IT·통신·모바일·게임>응용프로그래머>클라우드
https://kr.indeed.com/viewjob?jk=233bbfd9781e846d,"Engr, Tech Supp 3",KLA-Tencor 대한민국,,background Excel macro/code development for log analysis Python Database development for production Open to NCG (New College...
https://kr.indeed.com/viewjob?jk=b86fa42793152db8,[Search] 클라우드 컴퓨팅 플랫폼 BE 개발 신입/경력사원,네이버 서울,,위한 기술 제안 [자격요건] · CS 관련 탄탄한 기본기를 바탕으로 습득이 빠르신 분 · Java / Python / C / C++ 중 1 개 이상의 언어로 개발 가능 · 리눅스 환경에서의 개발 경험 · 우수한 문제 분석...
https://kr.indeed.com/viewjob?jk=9fe4755841bec8ce,"데이터 분석 및 컨설팅 분야 (Python, SAS, 빅데이터) 경력직",한국정보기술단 과천 과천시,,"데이터 분석 및 컨설팅 분야 ( Python, SAS, 빅데이터) 경력직... 대졸 이상 (학사 이상 우대) - 데이터 분석 분야 경력 2년 이상 ( Python, R, SAS 기반의 DATA Preparation, 통계, 머신러..."
https://kr.indeed.com/viewjob?jk=e9d6c53d8915adf6,"[Search] 파파고 머신러닝(자연어처리, 컴퓨터비전) 엔지니어 신입/...",네이버 서울,,"TensorFlow, PyTorch) · Python, C++ 등의 프로그... 자격요건] · 주도적으로 문제를 찾고, 해결할 수 있는 분 · Python 등의 프로그래밍 언어를 다룰 수 있는 분 · Tensorflow..."
https://kr.indeed.com/viewjob?jk=dbe3257e487e5814,[AI/Lab] AI 백엔드 엔지니어 (전문연구요원 가능),버즈니 서울,,"플랫폼 및 시스템 구축 이런 분을 찾습니다 주도적으로 문제를 찾고, 해결할 수 있는 능력을 보유하신 분 Python 사용 경험이 있으신 분 다음 항목 중 두 가지 이상에 해당되는 분 AWS 혹은 GCP와 같은 클라우드 플랫폼..."
https://kr.indeed.com/viewjob?jk=a2b8aae664300392,신한AI 인공지능(AI) 인력,신한에이아이 서울 영등포구,,"련전공 : 인공지능 / 수학 / 산업공학 / 컴퓨터공학 / 통계 관련 [우대사항] - 프로그래밍 숙련자 ( python 外 C++, Java 등) - 금융데이터 또는 시계열 데이터 기반 인공지능 모델 구축 및 운영경험 - 강화..."
https://kr.indeed.com/viewjob?jk=c130ad24ffc25b72,기술연구소 (AI연구 및 Python개발 / 드론 영상처리),선영종합엔지니어링 고양 덕양구,,어링 기술연구소 (AI연구 및 Python개발 / 드론 영상처리) 채용 4... 프로그래밍 ㆍBig Data 활용 및 Smart plant ㆍR 및 Python 기반 프로그램 개발 ㆍ정부출연사업 제안서 작성 [근무부서 및 직급...
https://kr.indeed.com/viewjob?jk=ff0d9391b85840fe,(주)바이오니아 2021년도 바이오인포메틱스 부문,바이오니아 대전 대덕구,,"자격요건] -. Bioinformatics 및 관련 분야 전공 -. 생물정보 분석 경험자 및 프로그래밍 가능자( python, perl, R, Java, c++) -. 생물학 관련 DB 활용 가능자(NCBI, Ensembl..."
https://kr.indeed.com/viewjob?jk=115c46e0d1df11d8,[개발자] 모비데이즈 프론트엔드 개발자 경력직 채용,Mobidays 서울특별시,,"험이 있으신 분 -활용 가능한 서버사이드 언어가 1개 이상 있는 분(Ruby, Java, Node.js, Python 등) -웹/모바일 광고 업계의 유사 업종 근무 경력 보유자 -플랫폼 또는 B2B 서비스 개발 프로젝트 참여..."
https://kr.indeed.com/viewjob?jk=c8d13289019f260f,[어니컴(주)] 데이터 분석가 신입/경력,어니컴 서울 용산구,,프로그래밍 언어: R 혹은 Python 활용 가능 - 통계 또는 기계학습에... 데이터분석|인터넷·IT·통신·모바일·게임>빅데이터·AI(인공지능)> Python|인터넷·IT·통신·모바일·게임>빅데이터·AI(인공지능)>R|인터넷...
https://kr.indeed.com/viewjob?jk=bd71e33adadfe4ac,HE Cryptographer,Intel 4.1 서울,,Implementation skills for developing software prototypes with Python C C Java or other languages... Mathematica...
https://kr.indeed.com/viewjob?jk=71c47ac87bb4087e,기술 인턴 인공지능 응용 연구/개발 인턴,써로마인드로보틱스 서울 관악구,,"6개월) (협의) *모집 절차: 서류 à인터뷰(오프라인) *지원 자격: 프로그래밍 언어 활용 능력: Python, C, C++ 중 1가지 이상 데이터구조, 알고리즘 과목 이수 머신러닝과 딥러닝의 기본 개념 이해 머신러닝..."
https://kr.indeed.com/viewjob?jk=14076e1efa25f8da,그린뉴딜분야 연계형 교육 참여,사단법인 한국벰스협회 서울 구로구,,게임>빅데이터·AI(인공지능)> Python|인터넷·IT·통신·모바일·게임... 로그래머>증강현실(AR)|인터넷·IT·통신·모바일·게임>응용프로그래머> Python|인터넷·IT·통신·모바일·게임>응용프로그래머>머신러닝(ML)|인터넷...
https://kr.indeed.com/viewjob?jk=54e0d08c99dcf507,MI(Market Intelligence)담당 마케팅 전략 경력사원,LG전자 3.8 서울 영등포구,,"마케팅 전략/방향성 도출 경험 보유 4) 우대 사항 - 통계 분석 및 프로그래밍 언어 역량 보유: R, python, Java, SPSS, Tableau, etc. - 영어 능통 역량: 해외법인과 영어 화상 회의 및 현지..."
https://kr.indeed.com/viewjob?jk=52f8fb3f7e662c5d,[카카오커머스] 기술직군,카카오커머스 성남 분당구,,"Keras, Pytorch 등) - Python을 활용한 머신러닝/딥러닝... 이상 사용 경험이 있으신 분 - 프로그램 개발(Java, Scala, Python 등) 중급 이상 기술 보유하신 분 - 대용량 데이터에 대한 실시간..."
https://kr.indeed.com/viewjob?jk=01296857655fc85f,(주)신세계아이앤씨 AI/클라우드 부문 상시,신세계아이앤씨 서울 중구,,"험자 -. Programming : Python, Java, Node.js... 구축 프로젝트 PM or AA 경험자 -. Programming : Python, Java, Node.js, Ruby, .NET, Scala ※ 상기..."
https://kr.indeed.com/viewjob?jk=144c42a3c09caa9b,파이썬 신입 개발자 (정규직),쇼엠 인천 연수구,,실이 있을 경우 채용이 취소될 수 있습니다. 인터넷·IT·통신·모바일·게임>웹프로그래머> Python|인터넷·IT·통신·모바일·게임>응용프로그래머> Python|인터넷·IT·통신·모바일·게임>빅데이터·AI(인공지능)> Python
https://kr.indeed.com/viewjob?jk=84fd9f9deb6105b0,"웹개발, Python 외 신입/경력 계약직",쿠바로엠앤씨 서울 강서구,,"주식회사 쿠바로엠앤씨 웹개발, Python 외 신입/경력 계약직 채용 모집... 게임>웹프로그래머>웹개발|인터넷·IT·통신·모바일·게임>웹프로그래머> Python|인터넷·IT·통신·모바일·게임>웹프로그래머>백엔드|인터넷·IT·통신..."
https://kr.indeed.com/viewjob?jk=89f3e10d77a126bf,Field Service Engineer,Nearfield Instruments 대한민국,,"troubleshooting. Preferably to have coding capability (Matlab, Python...etc... data analysis, visualization, and algorithm..."
https://kr.indeed.com/viewjob?jk=ceb8243bc8ae3c35,[데이터 플랫폼]데이터 엔지니어 (전문연구요원 가능),버즈니 서울,,및 유지보수 이런 분을 찾습니다 관련 업무 경력 최소 3년 이상 있으신 분 (전문연구요원의 경우 경력 무관) Python 및 기반 데이터 플랫폼 개발 경험이 있으신 분 Docker(Contatiner) 기반 시스템 환경 구축...
https://kr.indeed.com/viewjob?jk=25725b3c0e607311,Junior Quant Trader,Byzantine Partners 서울,,background is a plus Programming capability is mandatory (i.e. Python) Understanding of machine learning algorithm is a plus...
https://kr.indeed.com/viewjob?jk=8af26b37623864c4,8퍼센트 개발자 (신입/경력),8퍼센트 서울 종로구,,개발 금융 데이터 분석과 분석 플랫폼 운영 자격요건 컴퓨터 전공자 또는 웹 개발 경력 1년 이상 우대사항 Python 코드를 무리 없이 읽으실 수 있는 분 Linux/Mac 사용 가능한 분 새로운 기술에 대한 호기심을 가지신...
https://kr.indeed.com/viewjob?jk=c52b13ca64b943c1,솔루션 엔지니어 (Network Infra),글로벌 네트워크 회사 서울 강남구,,"OpenShipft, Kubernetes, Microsoft Service) * Programming ( Python, JavaScript, Golang etc.) 근무 형태: 정규직 급여: 80,000,000원 - 120..."
https://kr.indeed.com/viewjob?jk=bf908061bb75a00a,블록체인 시스템 엔지니어 양성과정 교육생,에프앤이노에듀 서울,,게임>웹프로그래머>백엔드|인터넷·IT·통신·모바일·게임>웹프로그래머> Python|인터넷·IT·통신·모바일·게임>응용프로그래머>C#|인터넷·IT·통신... 게임>빅데이터·AI(인공지능)> Python|인터넷·IT·통신·모바일·게임...
https://kr.indeed.com/viewjob?jk=60d03da8a3724068,이공계 전문기술 연수사업 수강생,경기도경제과학진흥원 서울,,용프로그래머> Python|인터넷·IT·통신·모바일·게임>웹프로그래머>JAVA|인터넷·IT·통신·모바일·게임>웹프로그래머> Python|인터넷·IT·통신·모바일·게임>빅데이터·AI(인공지능)> Python|인터넷·IT·통신·모바일...
https://kr.indeed.com/viewjob?jk=a50fce6cc2cb57c9,자연어처리전문가 금융챗봇 만들어 갈 엔지니어,파운트 서울 충정로역,,리에 필요한 알고리즘을 개발하고 Python으로 구현 및 성능 검증을 진행... Description - 자연어 처리에 필요한 알고리즘을 개발하고 Python으로 구현 및 성능 검증을 진행 - 자연어 전처리 (형태소 분석...
https://kr.indeed.com/viewjob?jk=5e2d31fd9dd2ae62,대기업 영상처리 관련 IP 개발자 (판교),인파트너스 서울,,"Mentor Catapult HLS Tool 경험자 - Python 가능 [근무부서 및 직급/직책] 직급/직책: 대리, 과장, 차장 [자격요건] 경력... 게임>빅데이터·AI(인공지능)> Python|인터넷·IT·통신·모바일·게임..."
https://kr.indeed.com/viewjob?jk=f9dcc4b277dfcebc,[Search] [Vision] Computer Vision Engine...,네이버 서울,,"스템 엔지니어링 · 스마트렌즈 , 이미지 / 동영상 검색 , 비주얼 커머스 서비스 고도화에 기여 [자격요건] · Python, C++, Golang, Scala 등의 백엔드 개발 언어를 1 개 이상 자유롭게 활용 가능한 분..."
https://kr.indeed.com/viewjob?jk=6aebabcddef7f514,Field Application Engineer,Nearfield Instruments 대한민국,,"troubleshooting. Preferably to have coding capability (Matlab, Python...etc... data analysis, visualization, and algorithm..."
https://kr.indeed.com/viewjob?jk=13ead4619b06cd88,[한화테크윈]SW 개발 경력 채용,한화그룹 4.2 서울,,"Machine Learning/Deep Learning(Caffe, TensorFlow, Pytorch, Python, C/C++, Docker) - Feature extraction, low-level Image..."
https://kr.indeed.com/viewjob?jk=d143cbffed5f5411,[Search] 클라우드 AI 플랫폼 BE 개발 신입/경력사원,네이버 서울,,신러닝 플랫폼 개발 [자격요건] · CS 관련 탄탄한 기본기를 바탕으로 습득이 빠르신 분 · Java / Python / Go 언어 중 1 개 이상의 언어로 개발이 가능한 분 · 리눅스 환경에서 개발이 가능하신 분 [우대...
https://kr.indeed.com/viewjob?jk=93c307b1bbc3fa17,[Biz] 버티컬 서비스(여행/Flyer) & 광고플랫폼 FE/BE 개발...,네이버 서울,,"시스템 개발 - 네이버 광고 개인화 추천 시스템 개발 [자격요건] - Kotlin, Java, Scala, Python 중 1개 이상의 언어를 사용하여 웹서비스 개발 개발 2년 이상 - HTTP프로토콜에 대한 이해와 1개..."
https://kr.indeed.com/viewjob?jk=84453d20628049a6,Principal Business Analysis (Rocket Fres...,Coupang 2.9 서울,,"분 우대 사항 Tableau, Power BI 등 Visualization Tool 사용이 능숙한 분 Python, R 등 통계패키지 사용경험이 있는 분 이커머스 또는 인터넷 서비스 업계 근무경력 보유한 분 유통업계 기획..."
https://kr.indeed.com/viewjob?jk=7d4bc2a107c6669b,Customer Engineer,Microsoft 4.2 서울,,least 5 years welcome experience in model development using python or R. Experience in migrating from one database to another...
https://kr.indeed.com/viewjob?jk=b5d0fb51bc768703,Deep Learning Systems Research Engineer...,Qualcomm Korea YH 서울,,"PyTorch, TensorFlow... Good programming skills in Python/C/C++ - Good communication and presentation skills Preferred..."
https://kr.indeed.com/viewjob?jk=da5d4dd560fb6f85,Data Scientist,Garrett Advancing Motion 경기도,,"System/Data Integration • High level programming skills ( Python, R, Matlab, C++ or Java) • Machine Learning Algorithms..."
https://kr.indeed.com/viewjob?jk=a746de9c7a6168ef,Healthcare Real World Data Analyst 담당자,IQVIA 서울,,"HEOR 전반적인 업무 수행 Qualifications Claims Data 관련 분석 경력자 SAS / Python / R 등 통계 프로그래밍 언어 사용 가능자 통계학 전공자, 통계 및 Epidemiology 관련 석사..."
https://kr.indeed.com/viewjob?jk=5fabc892216e1c62,[Business Insights] Business Data Analys...,PUBG 서울,,"analytics... digital, consumer facing company • Knowledge of Python and Spark • Experience with large individual customer..."
https://kr.indeed.com/viewjob?jk=d6c05c588971df5a,백엔드 파운트 시스템 엔지니어 (현재 급여수준 이상 보장),파운트 서울 충정로역,,"경험 - Linux명령어 및shell스크립트 작성 능숙 우대사항 - Python, Java등을 이용한 프로그래밍 경험 네트워크및 서버에 대한 표준화... 립트 작성 능숙 우대사항 - Python, Java등을 이용한 프로그래..."
https://kr.indeed.com/viewjob?jk=6718bba08ef6e20b,모바일 앱 보안 솔루션 개발부문,스틸리언 서울 용산구,,"Android/iOS 모바일 앱 보안 제품입니다. - 앱수트는 C, Python 등을 통해 주로 개발합니다. - 앱수트 제품군에는 위변조 방지, 난독... 2) - Objective C, Python, C언어, Swift 개발..."
https://kr.indeed.com/viewjob?jk=dfe4f3638b0d10d2,블록체인 센터 백엔드 개발자 (경력),네오위즈 대한민국,,"센터 백엔드 개발자 (경력) 담당업무 블록체인을 이용한 서비스의 백엔드 설계 및 개발 자격요건 - Python/Node.js/Java 중 1가지 이상의 언어로, 서비스를 개발하는 것에 익숙한 분 - Restful API..."
https://kr.indeed.com/viewjob?jk=f0b26e01bccd1591,[김해 포스트코로나 청년일자리 지원 사업] 2021년 (주)디앤알팩토리...,디앤알팩토리 경상남도 김해,,"성과금 지급, 정기 휴가. 직무 내용 - 직무 내용 : Mavlink Protocol, Arduino, Python, C / C+, Java 를 이용한 소프트웨어 개발. [근무시간 및 형태] 주 5일 근무 (오전) 10시..."
https://kr.indeed.com/viewjob?jk=06995d4800ce38f3,Field Application Engineer (FAE) – Korea...,LUCID Vision Labs 대한민국,,debugging technique (OpenCL... Python experience is a plus). In-depth knowledge... OpenCL... Python experience is a plus...
https://kr.indeed.com/viewjob?jk=116009dbf59211ed,퍼즐데이터 역량있는 데이터 분석가,주식회사퍼즐데이터 서울 역삼동,,"데이터 마이닝 및 통계분석에 대한 전반적인 이해 3. 관련분야(산업공학, 통계 등) 전공 4. R or Python 사용 능력 * 이런 분은 더욱 좋아요. 1. 프로세스 마이닝 지식 보유자 2. 관련분야 대학원 전공 3..."
https://kr.indeed.com/viewjob?jk=741cc6ac364ea9be,Internal Infra Engineer,Toss 서울 강남구,,분 # 우대 사항 - Nutanix/VMWare 구축 운영 경험이 있으신 분 - Powershell 또는 Python 등을 사용한 시스템 관리 자동화 경험이 있으신 분 - 100명 이상 규모의 L3/L4 네트워크 관리 또는...
https://kr.indeed.com/viewjob?jk=80a65fe76f39fe46,[PUBG: NEW STATE] Data Analyst,PUBG 서울,,"Stackshare : https://stackshare.io/pubg/xtrm-data [지원 자격] - Python, SQL 등을 활용한 데이터 분석 경험자 - 데이터 시각화에 관심 많으신 분 - 한국에 거주하며..."
https://kr.indeed.com/viewjob?jk=0064deb5fa9cbce0,데이터 사이언티스트 모집,카카오 4.0 성남 판교역,,"양한 실험을 통해 알고리즘을 개선합니다. 지원자격 지원자격 하나 이상의 프로그래밍 언어에 익숙한 분( Python, Java, C/C++, Scala 등) 머신러닝/딥러닝 오픈소스를 이용하여 1년 이상 특정 서비스에 모델..."
https://kr.indeed.com/viewjob?jk=6a399a2c059ebbb1,Senior Solutions Engineer,Confluent 서울,,Computer Science or relevant experience Proficiency in Java or Python with experience developing ETL applications What gives...
https://kr.indeed.com/viewjob?jk=b30b332cacf6dc2d,OLED 광학 분야 경력사원,LG디스플레이 3.4 서울 마곡역,,"Tool (SETFOS, FEM/FDTD, Lighttools Code V 등) 유경험자 3) Matlab, Python, VBA 활용 데이터처리 가능자 4) ML 경험자 석사 이상 졸업 입사지원은 LG그룹 채용 홈페이지..."
https://kr.indeed.com/viewjob?jk=4d1b001be3234c14,유명대기업) 데이터엔지니어 초빙 (5년 이상~),에이치알니즈 서울,,"뢰감 우대사항 -AWS 환경에서의 데이터 운영, 개발 경험(Glue, Python, Airflow) -VisualizationBI Tool 활용 경험... 게임>빅데이터·AI(인공지능)> Python|인터넷·IT·통신·모바일·게임..."
https://kr.indeed.com/viewjob?jk=c58d20943e9dce58,테크니컬 오디오 디자이너(Technical Audio Designer)...,엔씨소프트 2.7 성남 판교역,,"4 활용 능력 - Protools, Reaper 등의 DAW 활용 능력 - 스크립팅 언어 활용 능력 ( Python, Lua, R 등) - 커뮤니케이션 능력 우대사항 - Wwise 자격증 보유 (101, 201, 251..."
https://kr.indeed.com/viewjob?jk=fcd031afcf77cfad,골프존 경력채용 - AI개발(머신러닝/데이터 엔지니어),골프존 4.2 서울,,야에서 그에 준하는 경험 - 영상 및 이미지 관련 (CV) 머신러닝/딥러닝 대한 기본적인 이해 및 C/C++/ Python 프로그래밍 경험 - 원활한 의사소통 및 협업 능력 - 논리적 사고 및 학습 능력 우대사항 - 5년 이상...
https://kr.indeed.com/viewjob?jk=2b2dcd3ffe3d53df,카카오 데이터의 가치를 발굴할 데이터 분석가 모집,카카오 4.0 성남 판교역,,"기술 통계량 이해 및 해석) 데이터 분석 업무를 수행할 수 있는 언어 스킬 필수 SQL 필수 R 또는 Python을 다룰 수 있는 분 (SAS, SPSS, GA, tableau 등 통계 툴만 사용 가능한 경우 제외) 하둡..."
https://kr.indeed.com/viewjob?jk=2bafb73f26c69508,[TmaxBI/기술] 빅데이터 플랫폼 QA,티맥스소프트 성남 분당구,,"갖춘자 - ERP/CRM 역량 보유자 - 데이터분석/모델링 역량 보유자 우대사항 - 보유기술: Java, python, RDB, NoSQL, OS(linux), Selenium, docker, Kubernetis - 자격사항..."
https://kr.indeed.com/viewjob?jk=0a8de9d8ee100dc8,1월 입사 - 근무 : 종각역 - S/W개발 정규직,제스웨어 서울 종로구,,자바스크립트|인터넷·IT·통신·모바일·게임>응용프로그래머>API|인터넷·IT·통신·모바일·게임>응용프로그래머> Python|인터넷·IT·통신·모바일·게임>웹프로그래머>백엔드|인터넷·IT·통신·모바일·게임>웹프로그래머>프론트엔드...
https://kr.indeed.com/viewjob?jk=18b288e9021d899f,NAVER IDC 서버 운영/관리,NIT Service 춘천 동면,,"Web, WAS에 대한 지식과 System application 운영 경험 - Shell script, python 활용 가능 - 해외 데이터센터 인프라 구축 또는 운영 경험 - 국가보훈대상자 및 장애인은 법령에 의거 우대..."
https://kr.indeed.com/viewjob?jk=0b9b89d4aca5a012,DevOps Developer,IBM 3.9 서울,,"Jenkins, Maven. Scripting: Any of BASH / Power shell, Python would be considered assets. Key responsibilities include..."
https://kr.indeed.com/viewjob?jk=97b032faeb4b1bd1,연구소 개발부문 연구원 직원 (회로설계/하드웨어설계/머신비전/이미지프로세...,모든 경기도 광명,,"프로그래밍 가능자 우대 S/W 설계 부문 : - OPEN CV, TENSORFLOW, YOLO, CUDA/ Python, C++, C WindowsGUL APL, MFC Lib 활용 가능자. 머신비전/ 영상처리 개발자 * 전기..."
https://kr.indeed.com/viewjob?jk=a22173d071050949,NLP Engineer for AI Startup (remote),MIND AI 서울 • 원격 근무,,"field. * 3+ years programming experience, 2+ years in Python especially in teams. * Thorough understanding of programming..."
https://kr.indeed.com/viewjob?jk=3d5f8e364a71247e,Software Engineer (Back-end),Streami 서울,,"Experience in JavaScript, Python or Java... one of: Modern Javascript, Java, Python * Experience building and maintaining..."
https://kr.indeed.com/viewjob?jk=46975ee759c13b8a,데이터 분석/처리 플랫폼 개발,NHN 4.4 성남 판교역,,"데이터 수집, 처리 및 지표 분석 경험 - 데이터 기반의 문제해결 역량 및 논리적 사고 - Java, Python, Scala 중 최소 1가지 언어를 이용한 데이터 분석 및 소프트웨어 개발 역량 - 통계분석..."
https://kr.indeed.com/viewjob?jk=73f619e964a56a10,[전문연구요원] ML/DL 연구원 및 SW 개발자,뷰노코리아 서울 서초구,,"Python, Javascript, Go, Java, C++, C# 중 최소 1개 이상의 언어에 익숙하신 분 - (우대) Python/Flask로... 그래머> Python|인터넷·IT·통신·모바일·게임>웹프로그래머> Python..."
https://kr.indeed.com/viewjob?jk=52a593e64d404756,Mid-Market Sales Engineer,DataDog 서울,,"demos Previous experience in one... following: Java, Python, Ruby, Go, Node.JS, PHP, or .NET Customer support or customer..."
https://kr.indeed.com/viewjob?jk=a24eee6864638bc4,Data Engineer,IBM 3.9 서울,,"Competitive products Deep skills on Data Warehouse, ETL, Python, Java and related algorithms. Expert Level – SQL, NoSQL..."
